{
 "meta": {
  "title": "Now · 6 Sep 20:29",
  "description": "Who is doing what right now, from atlas/now.json (herdr agent list on laptop and Mini + owners.log/OWNERS.md latest lines): live seats with freshness chips, dated owner observations, stale seats, repo activity in the last 24 h, coverage limits, whom to message.",
  "stream": "now",
  "crumb": [
   {
    "label": "Templates",
    "href": "/"
   },
   {
    "label": "U10 · Now",
    "href": "/t/U10/"
   },
   {
    "label": "6 Sep 20:29"
   }
  ],
  "actions": [
   {
    "label": "atlas NOW.html",
    "href": "https://github.com/sisodias/siso-agent-zero-protocol",
    "icon": "activity",
    "external": true
   },
   {
    "label": "bin/az-now",
    "href": "https://github.com/sisodias/siso-agent-zero-protocol",
    "icon": "terminal",
    "external": true
   }
  ],
  "source": "00_AGENT_ZERO/atlas/now.json generated \"06 Sep 2026 20:29 +0700\" by bin/az-now (herdr --session herdr-2|default agent list on laptop, mini-herdr agent list on Mini; 15 log sources; 20 log issues) · git log -1 / rev-list --since 24 h in six local checkouts, 20:27 UTC+07"
 },
 "heading": {
  "breadcrumb": [
   {
    "label": "Now"
   },
   {
    "label": "6 Sep 2026"
   },
   {
    "label": "20:29 +07"
   }
  ],
  "kicker": "now <span class=\"sep\">·</span> observed 6 Sep 20:29 +07 <span class=\"sep\">·</span> <span class=\"dim\">2 nodes · 10 seats · 22 owner reports</span>",
  "title": "Now",
  "subtitle": "10 seats answer <code>herdr agent list</code> across the laptop and the Mac Mini: 2 working, 5 idle, 3 done. Every line below is a timestamped writeback from owners.log or OWNERS.md; nothing is inferred. Freshness is measured against the observation time, not the reader's clock.",
  "badges": [
   {
    "label": "observed 20:29 +07",
    "tone": "now",
    "dot": true
   },
   {
    "label": "2 fresh · <1 h",
    "tone": "now",
    "href": "#live"
   },
   {
    "label": "3 within 24 h",
    "tone": "warn",
    "href": "#live"
   },
   {
    "label": "5 no writeback",
    "tone": "blocked",
    "href": "#live"
   },
   {
    "label": "16 seats wrote back but are not live",
    "tone": "muted",
    "href": "#stale"
   },
   {
    "label": "node errors · 0",
    "tone": "now"
   }
  ],
  "status": {
   "kicker": "Last writeback anywhere",
   "value": "20:26 · TEMPLATE-BANK-ZERO-2",
   "note": "heading align fix (his 20:20) · U6 Erdős 742 live (20 of 24); issue #59 closed; siso-shell 4a5fc11 · handoffs/TEMPLATE-BANK.md: \"D-36 scrub 4e30a78 (0 hits live)\". Seats read at 20:29; this page is a snapshot and says so.",
   "facts": [
    {
     "k": "laptop",
     "v": "6 seats · herdr-2 + default"
    },
    {
     "k": "mini",
     "v": "4 seats · default"
    },
    {
     "k": "unowned claims",
     "v": "0"
    },
    {
     "k": "log issues",
     "v": "22 (scan limit; 2 lines without time; malformed lines 153–155)"
    }
   ]
  }
 },
 "sections": {
  "live": {
   "n": "01",
   "title": "Live seats",
   "sub": "runtime status from herdr; last writeback from the owner logs; freshness against 20:29"
  },
  "observations": {
   "n": "02",
   "title": "Dated owner observations",
   "sub": "the latest owner report per seat, newest first; owner text is an attributed report, never acceptance"
  },
  "stale": {
   "n": "03",
   "title": "Stale · seats that wrote back but are not live",
   "sub": "their last line, its age, where it was written"
  },
  "repos": {
   "n": "04",
   "title": "Repo activity · last 24 h",
   "sub": "local checkouts, git log; six of the repos the live seats sit in"
  },
  "coverage": {
   "n": "05",
   "title": "Coverage",
   "sub": "what this snapshot could and could not see"
  },
  "message": {
   "n": "06",
   "title": "Who to message",
   "sub": "address seats by name (herdr-send NAME \"…\"); pane ids are volatile"
  },
  "timeline": {
   "n": "07",
   "title": "Last 24 h"
  },
  "agent": {
   "n": "08",
   "title": "Agent entry"
  }
 },
 "generated_at": "2026-09-06 20:29 +07",
 "metrics": [
  {
   "value": 10,
   "label": "seats live (herdr)",
   "tone": "now",
   "href": "#live"
  },
  {
   "value": 2,
   "label": "working",
   "tone": "now"
  },
  {
   "value": 5,
   "label": "idle",
   "tone": "warn"
  },
  {
   "value": 3,
   "label": "done",
   "tone": "muted"
  },
  {
   "value": 3,
   "label": "writebacks in the last hour",
   "tone": "now",
   "href": "#observations"
  },
  {
   "value": 19,
   "label": "in the last 24 h",
   "tone": "projects",
   "href": "#observations"
  },
  {
   "value": 22,
   "label": "latest owner reports",
   "tone": "muted"
  }
 ],
 "seats": [
  {
   "name": "AGENT-ZERO",
   "node": "laptop",
   "node_tone": "projects",
   "status": "done",
   "status_tone": "muted",
   "cwd": "~/SISO_Workspace/00_AGENT_ZERO",
   "last": "2026-09-06 19:53 · 24 issues closed; builder at 59% ctx",
   "fresh": "36 min",
   "fresh_tone": "now",
   "fresh_dot": true
  },
  {
   "name": "TEMPLATE-BANK-ZERO-2",
   "node": "laptop",
   "node_tone": "projects",
   "status": "working",
   "status_tone": "now",
   "cwd": "~/SISO_Workspace/siso-shell",
   "last": "2026-09-06 20:26 · TEMPLATE-BANK.md",
   "fresh": "2 min",
   "fresh_tone": "now",
   "fresh_dot": true,
   "href": "/t/U17/"
  },
  {
   "name": "BYK FABLE",
   "node": "laptop",
   "node_tone": "projects",
   "status": "idle",
   "status_tone": "warn",
   "cwd": "~/SISO_Workspace/SISO_Agency/clients/fahmy-2026-08/bykonzyard",
   "last": "none in owners.log / OWNERS.md",
   "fresh": "no timestamped writeback",
   "fresh_tone": "blocked",
   "fresh_dot": false
  },
  {
   "name": "ORACLE-ZERO",
   "node": "laptop",
   "node_tone": "projects",
   "status": "idle",
   "status_tone": "warn",
   "cwd": "~/SISO_Workspace/SISO_Agency/apps/oracle-streaming",
   "last": "2026-09-05 19:58 · ORACLE-ZERO-HANDOFF.md",
   "fresh": "1.0 d",
   "fresh_tone": "blocked",
   "fresh_dot": false
  },
  {
   "name": "ORACLE-OPERATOR",
   "node": "laptop",
   "node_tone": "projects",
   "status": "working",
   "status_tone": "now",
   "cwd": "~/SISO_Workspace/SISO_Agency/apps/oracle-operator/.worktrees/cf-integration",
   "last": "2026-09-06 00:26 · ORACLE-OPERATOR-HANDOFF.md",
   "fresh": "20.0 h",
   "fresh_tone": "warn",
   "fresh_dot": false
  },
  {
   "name": "OPERATOR-UI",
   "node": "laptop",
   "node_tone": "projects",
   "status": "idle",
   "status_tone": "warn",
   "cwd": "~/SISO_Workspace/SISO_Agency/apps/oracle-operator/.worktrees/operator-ui-20260906",
   "last": "none in owners.log / OWNERS.md",
   "fresh": "no timestamped writeback",
   "fresh_tone": "blocked",
   "fresh_dot": false
  },
  {
   "name": "ERDOS-LEAD",
   "node": "mini",
   "node_tone": "now",
   "status": "idle",
   "status_tone": "warn",
   "cwd": "~/SISO_Workspace/SISO_Research/erdos",
   "last": "none in owners.log / OWNERS.md",
   "fresh": "no timestamped writeback",
   "fresh_tone": "blocked",
   "fresh_dot": false
  },
  {
   "name": "SISO-PERF-SOL",
   "node": "mini",
   "node_tone": "now",
   "status": "idle",
   "status_tone": "warn",
   "cwd": "~/SISO_Workspace/SISO_Internal_Lab",
   "last": "none in owners.log / OWNERS.md",
   "fresh": "no timestamped writeback",
   "fresh_tone": "blocked",
   "fresh_dot": false
  },
  {
   "name": "PLAYS-ZERO",
   "node": "mini",
   "node_tone": "now",
   "status": "done",
   "status_tone": "muted",
   "cwd": "~/SISO_Workspace/SISO_Agents/siso-skills-hub",
   "last": "2026-09-06 01:28 · plays-verification-2026-09-05.json",
   "fresh": "19.0 h",
   "fresh_tone": "warn",
   "fresh_dot": false
  },
  {
   "name": "INTENT-DISTILLATION",
   "node": "mini",
   "node_tone": "now",
   "status": "done",
   "status_tone": "muted",
   "cwd": "~/SISO_Workspace/SISO_Knowledge/.siso-local/siso-source",
   "last": "2026-09-06 05:33 · KNOWLEDGE-PEOPLE.md",
   "fresh": "14.9 h",
   "fresh_tone": "warn",
   "fresh_dot": false
  }
 ],
 "stale": [
  {
   "name": "TEMPLATE-BANK-ZERO",
   "last": "2026-09-06 19:58",
   "age": "31 min",
   "tone": "now",
   "path": "handoffs/TEMPLATE-BANK.md"
  },
  {
   "name": "REVIEW-ZERO",
   "last": "2026-09-06 16:32",
   "age": "3.9 h",
   "tone": "warn",
   "path": "handoffs/REVIEW.md"
  },
  {
   "name": "BYK-ZERO",
   "last": "2026-09-06 15:22",
   "age": "5.1 h",
   "tone": "warn",
   "path": "00_AGENT_ZERO/handoffs/BYK.md"
  },
  {
   "name": "IMPROVEMENT-ZERO",
   "last": "2026-09-06 15:09",
   "age": "5.3 h",
   "tone": "warn",
   "path": "atlas/IMPROVEMENT-2026-09-06.html"
  },
  {
   "name": "FOUNDRY-ZERO",
   "last": "2026-09-06 14:27",
   "age": "6.0 h",
   "tone": "warn",
   "path": "00_AGENT_ZERO/handoffs/agency-drivers/FOUNDRY.md"
  },
  {
   "name": "ACTION-MODEL-ZERO",
   "last": "2026-09-06 14:13",
   "age": "6.3 h",
   "tone": "warn",
   "path": "00_AGENT_ZERO/handoffs/agency-drivers/ACTION-MODEL.md"
  },
  {
   "name": "HALO-ZERO",
   "last": "2026-09-06 13:17",
   "age": "7.2 h",
   "tone": "warn",
   "path": "00_AGENT_ZERO/handoffs/HALO.md"
  },
  {
   "name": "GQ-COMPUTE",
   "last": "2026-09-06 13:12",
   "age": "7.3 h",
   "tone": "warn",
   "path": "00_AGENT_ZERO/handoffs/GQ-COMPUTE.md"
  },
  {
   "name": "MAIN-ZERO",
   "last": "2026-09-06 13:11",
   "age": "7.3 h",
   "tone": "warn",
   "path": "handoffs/MAIN-ZERO.md"
  },
  {
   "name": "LIBRARY-ZERO",
   "last": "2026-09-06 12:52",
   "age": "7.6 h",
   "tone": "warn",
   "path": "CURRENT_STATE.md"
  },
  {
   "name": "LAPTOP-ORGANIZER",
   "last": "2026-09-06 12:48",
   "age": "7.7 h",
   "tone": "warn",
   "path": "00_AGENT_ZERO/handoffs/LAPTOP-ORGANIZER.md"
  },
  {
   "name": "INTERNAL-ZERO",
   "last": "2026-09-06 06:25",
   "age": "14.1 h",
   "tone": "warn",
   "path": "00_AGENT_ZERO/handoffs/agency-drivers/INTERNAL.md"
  },
  {
   "name": "ORACLE-REBUILD/FIXER",
   "last": "2026-09-06 00:11",
   "age": "20.3 h",
   "tone": "warn",
   "path": ".agents/briefs/ORACLE-REBUILD-HANDOFF.md"
  },
  {
   "name": "ORACLE-REBUILD",
   "last": "2026-09-05 20:46",
   "age": "23.7 h",